{
  "schema": "kiln.serving-benchmark-server-launch.v1",
  "id": "kiln-rocm-strix-halo-serving-comparison-decode-batch-4-actor-cycle-idle-100ms-prefill-layers-32-v1",
  "command": [
    "./target/release/kiln",
    "serve",
    "--config",
    "qualification/server-config/kiln-rocm-strix-halo-serving-comparison-decode-batch-4-actor-cycle-idle-100ms-prefill-layers-32-v1.toml"
  ],
  "working_directory": "../..",
  "log_directory": "../../.qualification/kiln-serving/logs/decode-batch-4-actor-cycle-idle-100ms-prefill-layers-32-v1",
  "readiness_poll_interval_ms": 250,
  "startup_timeout_seconds": 600.0,
  "shutdown_timeout_seconds": 65.0,
  "acceptable_exit_codes": [
    0
  ]
}
